{
  "schemaVersion": "0.2",
  "packVersion": "0.2.0",
  "minimumIntentOSVersion": "0.41.0",
  "lastReviewedAt": "2026-06-27",
  "stabilityNotes": "Draft pack; requires real project dogfood, false-positive review, and strict BL2 evidence before promotion.",
  "id": "wechat-miniprogram-industrial",
  "type": "primary-platform",
  "displayName": "WeChat Mini Program Industrial Pack",
  "status": "draft",
  "appliesToProfiles": [
    "wechat-miniprogram"
  ],
  "compatiblePacks": [
    "web-app-industrial",
    "backend-api-industrial",
    "internal-admin-industrial",
    "cloudbase-industrial",
    "auth-permission-industrial",
    "data-storage-industrial",
    "payment-value-transfer-industrial",
    "high-risk-change-industrial"
  ],
  "conflictsWith": [],
  "requiredBaselines": [
    "baselines/miniprogram-runtime-release-baseline.md",
    "baselines/miniprogram-runtime-baseline.md",
    "baselines/miniprogram-cloudbase-security-baseline.md",
    "baselines/miniprogram-privacy-payment-baseline.md",
    "baselines/miniprogram-release-readiness-baseline.md"
  ],
  "requiredExecutionDocs": [
    "executions/codex-miniprogram-industrial-execution.md"
  ],
  "requiredAuditDocs": [
    "audit/miniprogram-existing-project-audit.md",
    "audit/miniprogram-runtime-quality-audit.md",
    "audit/miniprogram-release-readiness.md"
  ],
  "requiredChecklists": [
    "checklists/miniprogram-release-checklist.md",
    "checklists/miniprogram-ui-state-checklist.md",
    "checklists/miniprogram-cloud-function-checklist.md",
    "checklists/miniprogram-auth-permission-checklist.md",
    "checklists/miniprogram-payment-checklist.md",
    "checklists/miniprogram-release-review-checklist.md"
  ],
  "requiredTemplates": [
    "templates/miniprogram-release-record.md",
    "templates/miniprogram-runtime-evidence.md",
    "templates/miniprogram-incident-record.md"
  ],
  "riskMappings": {
    "wechat-login": [
      "auth",
      "permission",
      "personal data"
    ],
    "platform-permission": [
      "privacy",
      "platform dependency",
      "personal data",
      "app signing / platform release"
    ],
    "cloud-function": [
      "cloud function / access rule",
      "external side effect",
      "production config",
      "api failure"
    ],
    "cloud-access-rule": [
      "cloud function / access rule",
      "permission",
      "personal data"
    ],
    "subscription-message": [
      "external side effect",
      "platform dependency"
    ],
    "share-entry": [
      "external side effect",
      "platform dependency"
    ],
    "mini-program-release": [
      "app signing / platform release",
      "production config"
    ],
    "client-storage": [
      "data persistence",
      "privacy",
      "personal data"
    ],
    "value-transfer": [
      "regulated operation",
      "irreversible operation"
    ]
  },
  "taskLevelEscalation": [
    {
      "when": [
        "wechat-login",
        "platform-permission",
        "client-storage",
        "cloud-function",
        "cloud-access-rule",
        "subscription-message",
        "share-entry"
      ],
      "minTaskLevel": "L2"
    },
    {
      "when": [
        "mini-program-release",
        "production-config",
        "value-transfer",
        "regulated-data"
      ],
      "minTaskLevel": "L3"
    }
  ],
  "requiredEvidence": {
    "ui-state": [
      "mini program loading-empty-error-forbidden evidence",
      "mini program lifecycle evidence",
      "navigation and return-path evidence",
      "critical flow behavior evidence"
    ],
    "wechat-login": [
      "WeChat login state evidence",
      "session binding evidence",
      "denied permission evidence"
    ],
    "platform-permission": [
      "platform permission prompt evidence",
      "denied permission evidence",
      "privacy authorization evidence"
    ],
    "cloud-function-access-rule": [
      "cloud function boundary evidence",
      "cloud access rule evidence",
      "storage access evidence",
      "API failure and recovery evidence",
      "production configuration review"
    ],
    "client-storage": [
      "client storage minimization evidence",
      "sensitive data handling evidence"
    ],
    "subscription-share": [
      "subscription message authorization evidence",
      "share entry behavior evidence"
    ],
    "payment": [
      "payment request validation evidence",
      "payment callback idempotency evidence",
      "refund or failure recovery evidence"
    ],
    "release": [
      "experience version evidence",
      "release submission readiness",
      "platform review readiness",
      "rollback or mitigation plan",
      "monitoring evidence"
    ]
  },
  "humanApprovalRequiredFor": [
    "external-account-or-provider-action",
    "irreversible-production-data-effect",
    "paid-service-or-value-transfer",
    "production-or-external-release",
    "real-user-communication",
    "regulated-data-export-to-external-recipient"
  ],
  "maturity": {
    "stage": "draft",
    "stageReason": "Draft pack; requires real project dogfood, false-positive review, and strict BL2 evidence before promotion.",
    "lastMaturityReviewAt": "2026-06-27",
    "reviewedBy": "IntentOS maintainers",
    "evidenceDocs": [
      "maturity.md",
      "evidence.md",
      "dogfood.md",
      "false-positive-log.md",
      "owner.md",
      "changelog.md"
    ],
    "evidenceSummary": [
      "Pack structure exists and is checked by `check-industrial-pack.mjs`.",
      "Required baseline, execution, audit, checklist, template, and bootstrap docs are present.",
      "No real project evidence is embedded in the pack; project proof belongs in adopting project docs."
    ],
    "missingEvidenceBeforeCandidate": [
      "At least one real project dogfood with recorded BL2 selection and baseline evidence.",
      "A review loop report that records findings, false positives, and fixes.",
      "A maintainer review confirming the pack did not require unsafe bypasses."
    ],
    "missingEvidenceBeforeStable": [
      "At least two real project dogfoods use the pack without bypassing required gates.",
      "At least one existing-project adoption records no blocking mismatch or records the fix.",
      "`check-industrial-pack.mjs` passes for the pack.",
      "`check-industrial-baseline.mjs --strict` passes in a project that selected the pack.",
      "False positives, missing checks, and follow-up changes are recorded."
    ],
    "promotionCriteria": [
      "At least two real project dogfoods use the pack without bypassing required gates.",
      "At least one existing-project adoption records no blocking mismatch or records the fix.",
      "`check-industrial-pack.mjs` passes for the pack.",
      "`check-industrial-baseline.mjs --strict` passes in a project that selected the pack.",
      "False positives, missing checks, and follow-up changes are recorded."
    ],
    "demotionTriggers": [
      "A pack gate repeatedly blocks valid work without a documented fix.",
      "A project adoption finds unsafe guidance, missing evidence, or misleading claims.",
      "A platform or toolchain change makes required checks obsolete.",
      "The owner cannot review the pack before a stage-changing release."
    ],
    "knownLimitations": [
      "Draft status means this pack is not stable and not a default project standard.",
      "The pack describes required evidence; it does not prove an adopting project has that evidence.",
      "Project-specific architecture, data, permission, release, and rollback decisions remain outside the pack."
    ]
  }
}
