{
  "schemaVersion": "0.2",
  "packVersion": "0.2.0",
  "minimumIntentOSVersion": "0.41.0",
  "lastReviewedAt": "2026-06-27",
  "stabilityNotes": "Draft pack; requires real project dogfood, false-positive review, and strict BL2 evidence before promotion.",
  "id": "internal-admin-industrial",
  "type": "capability",
  "displayName": "Internal Admin Industrial Pack",
  "status": "draft",
  "appliesToProfiles": [
    "internal-admin"
  ],
  "compatiblePacks": [
    "web-app-industrial",
    "wechat-miniprogram-industrial",
    "backend-api-industrial",
    "auth-permission-industrial",
    "data-storage-industrial",
    "payment-value-transfer-industrial",
    "high-risk-change-industrial"
  ],
  "conflictsWith": [],
  "requiredBaselines": [
    "baselines/admin-permission-operation-baseline.md"
  ],
  "requiredExecutionDocs": [
    "executions/codex-internal-admin-industrial-execution.md"
  ],
  "requiredAuditDocs": [
    "audit/internal-admin-existing-project-audit.md"
  ],
  "requiredChecklists": [
    "checklists/admin-operation-checklist.md"
  ],
  "requiredTemplates": [
    "templates/admin-operation-record.md"
  ],
  "riskMappings": {
    "admin-role": [
      "permission",
      "security"
    ],
    "privileged-operation": [
      "regulated operation",
      "security"
    ],
    "production-data": [
      "regulated data",
      "privacy"
    ],
    "manual-override": [
      "irreversible operation",
      "operational risk"
    ],
    "destructive-operation": [
      "irreversible operation",
      "data deletion"
    ]
  },
  "taskLevelEscalation": [
    {
      "when": [
        "admin-role",
        "privileged-operation",
        "production-data"
      ],
      "minTaskLevel": "L2"
    },
    {
      "when": [
        "manual-override",
        "destructive-operation",
        "value-transfer",
        "regulated-data"
      ],
      "minTaskLevel": "L3"
    }
  ],
  "requiredEvidence": {
    "admin-change": [
      "role matrix evidence",
      "forbidden state evidence",
      "resource scope evidence"
    ],
    "operation-change": [
      "audit trail evidence",
      "confirmation or rollback evidence",
      "production data boundary evidence"
    ],
    "release": [
      "operator impact review",
      "rollback or mitigation plan",
      "monitoring evidence"
    ]
  },
  "humanApprovalRequiredFor": [
    "irreversible-production-data-effect",
    "paid-service-or-value-transfer",
    "production-or-external-release",
    "real-user-communication",
    "regulated-data-export-to-external-recipient"
  ],
  "maturity": {
    "stage": "draft",
    "stageReason": "Draft pack; requires real project dogfood, false-positive review, and strict BL2 evidence before promotion.",
    "lastMaturityReviewAt": "2026-06-27",
    "reviewedBy": "IntentOS maintainers",
    "evidenceDocs": [
      "maturity.md",
      "evidence.md",
      "dogfood.md",
      "false-positive-log.md",
      "owner.md",
      "changelog.md"
    ],
    "evidenceSummary": [
      "Pack structure exists and is checked by `check-industrial-pack.mjs`.",
      "Required baseline, execution, audit, checklist, template, and bootstrap docs are present.",
      "No real project evidence is embedded in the pack; project proof belongs in adopting project docs."
    ],
    "missingEvidenceBeforeCandidate": [
      "At least one real project dogfood with recorded BL2 selection and baseline evidence.",
      "A review loop report that records findings, false positives, and fixes.",
      "A maintainer review confirming the pack did not require unsafe bypasses."
    ],
    "missingEvidenceBeforeStable": [
      "At least two real project dogfoods use the pack without bypassing required gates.",
      "At least one existing-project adoption records no blocking mismatch or records the fix.",
      "`check-industrial-pack.mjs` passes for the pack.",
      "`check-industrial-baseline.mjs --strict` passes in a project that selected the pack.",
      "False positives, missing checks, and follow-up changes are recorded."
    ],
    "promotionCriteria": [
      "At least two real project dogfoods use the pack without bypassing required gates.",
      "At least one existing-project adoption records no blocking mismatch or records the fix.",
      "`check-industrial-pack.mjs` passes for the pack.",
      "`check-industrial-baseline.mjs --strict` passes in a project that selected the pack.",
      "False positives, missing checks, and follow-up changes are recorded."
    ],
    "demotionTriggers": [
      "A pack gate repeatedly blocks valid work without a documented fix.",
      "A project adoption finds unsafe guidance, missing evidence, or misleading claims.",
      "A platform or toolchain change makes required checks obsolete.",
      "The owner cannot review the pack before a stage-changing release."
    ],
    "knownLimitations": [
      "Draft status means this pack is not stable and not a default project standard.",
      "The pack describes required evidence; it does not prove an adopting project has that evidence.",
      "Project-specific architecture, data, permission, release, and rollback decisions remain outside the pack."
    ]
  }
}
